,job_title,company_name,summary
468,intern private capital portfolio management team months contract,ontario teachers' pension plan,strategy projects operations creation performance metrics portfolio companies gathering data industry research executing analysis
469,content marketing seo specialist paid internship,guarana technologies,content calendar track data reports date truly care client success assist
470,sap ixp intern concur spend software developer,sap,adopt agile software development model develop software deliver frequent cadence multiple data centers
471,actuarial analyst p c winter internship co op toronto,deloitte,partner clients solve complex problems service line performs client engagements include limited
472,marketing analytics intern january,loyaltyone,sas sql relational databases data warehouse bi data visualization tools analyst intern plays integral role application execution
473,graduate student oil laboratory experimentalist,imperial oil,team researches new improves existing recovery processes economically extract bitumen reducing ghg water use intensity
474,student mining,stantec,assists collecting data gathering information support design decisions role student assist project managers
475,marketing internship paid,red stamp agency,accepted internship required work team members develop digital marketing strategies content
476,marketing analytics intern january,alliancedata,sas sql relational databases data warehouse bi data visualization tools analyst intern plays integral role application execution
477,marketing intern,rise cpa,updating data base firm s contact alliances rise advisors seeking intern support marketing team degree marketing preferred
478,financial analyst financial analysis business support winter,deloitte,advanced excel macros functions working large volumes data enjoy flexible proactive practical benefits foster culture
479,stack engineer,wise systems,wise systems came mit inspired goal using data make cities smarter building new feature creating data integration making
480,intern analyst investment finance april,psp investments,intern analyst investment finance ll seeking intern analyst investment finance partner key stakeholders peers
481,sap ixp intern general business dde global coordinator,sap,sap general business ixp intern dde global coordinator includes preparation reports data analysis benchmark teams
482,intern analyst real estate investments january april,psp investments,intern analyst real estate investments ll provide assistance analysts researching synthesizing analyzing data various real
483,content marketing seo specialist paid internship,guarana technologies,content calendar track data reports date nutshell guaraná mobile application
484,sap ixp intern concur spend software developer,sap,concur spend software developer intern adopt agile software development model develop software deliver frequent
485,actuarial analyst p c winter internship co op toronto,deloitte,partner clients solve complex problems experience firm wellness matters empowered lead impact clients
486,marketing analytics intern january,loyaltyone,sas sql relational databases data warehouse bi data visualization tools alliance data participates coffee sparkling water
487,graduate student oil laboratory experimentalist,imperial oil,successful candidate join imperial oil heavy oil upstream research team team researches new improves existing
488,student mining,stantec,assists collecting data gathering information support design decisions core community join redefine personal best
489,marketing internship paid,red stamp agency,interns responsible generating content variety media platforms sounds like want talk bringing
490,marketing analytics intern january,alliancedata,sas sql relational databases data warehouse bi data visualization tools alliance data participates free coffee sparkling water
491,business analyst months,td bank,exceptional excel data management skills experience presenting data visually creatively ability investigate data
492,tester qa month,td bank,help define test data environment requirements support automation test data management strategies testing activities focus
493,content marketing operations internship,lokafy,150 month travel stipend interns analyze data channels work agreed kpis
494,pharmacy intern,strathmore remedys rx pharmacy,registered alberta college pharmacy pharmacy intern supervision pharmacist pharmacy intern perform data entry filling
495,automation hardware engineer,ciena,perform data analysis test yield early identify design related hardware software performance test automation robustness issues
496,marketing analytics intern january,precima,sas sql relational databases data warehouse bi data visualization tools analyst intern plays integral role application execution
497,sap ixp intern marketing operations specialist,sap,internship great opportunity develop solid foundation understanding global marketing takes run world class
498,petroleum engineering student,suncor energy services,analyze review daily production data accuracy input data management systems identify optimization opportunities
499,intern analyst balance sheet management january april,psp investments,knowledge market data collection systems bloomberg datastream asset seeking intern analyst balance sheet management
500,solutions delivery winter months months,deloitte,proficiency technologies like sharepoint sql server database experienced using data analysis tools
501,employee engagement coordinator,td bank,exceptional excel data management skills experience presenting data visually creatively ability investigate data
502,financial analyst sap projects month winter,deloitte,sap financial analyst lead data cleanup including reviewing comparing data making necessary updates
503,content marketing seo specialist paid internship,guarana,content calendar track data reports date truly care client success assist
504,retirement service center internship winter summer fall university,willis towers watson,perform data analysis reconciliations pension plan participant data addition participate systematic training program interns
505,business analyst total fund reporting month contract,ontario teachers' pension plan,analyse solution issues related data problems coordinate fixes solution engineering team business analyst intern participate
506,backend developer,careguide inc,deep understanding various data stores people management pure technical track functions data science product management
507,digital content marketing internship,mr. star,task data management program years old excited join team intern digital content marketing intern
508,wealth products group,td bank,data analytics reporting deposit credit products intern support team following activities
509,business analyst waterloo,td bank,exceptional excel data management skills experience presenting data visually creatively ability investigate data
510,paid bilingual marketing co op intern stagiaire en marketing bilingue,posera software inc,english french required report marketing communications liaison members
511,winter garage internship program software engineering program management vancouver,microsoft,communicate process understand progress delivery technical challenges provide clarity customer needs using
512,sap ixp intern product strategy platform oem,sap,candidate able synthesize analyze large quantities data whilst showing creative pragmatic approach problem solving
513,situ resources engineering student,suncor energy services,develop new toolkits exploring opportunities automation data analytics collaborate meaningful technical projects support suncor
514,senior machine learning engineer,augmenta,interactive graphics data visualization mentor junior staff interns reach best potential fluent python
515,fall intern student business logistics management,tricorbraun,strong administrative data management skills intern student work closely site lead account coordinators
516,graduate student oil laboratory experimentalist,exxonmobil,team researches new improves existing recovery processes economically extract bitumen reducing ghg water use intensity
517,project management governance,td bank,work alongside teammates develop insights recommendations based enterprise portfolio research data analysis cumulative gpa higher
518,sap ixp intern gtlc compliance support,sap,provide codecenter support involves data entry tasks meet mentors make new friends globe create thriving personal
519,digital marketing intern mandarin chinese required,hilborn digital,research industry trends analyze competitor data looking digital marketing specialist intern strong understanding chinese
520,software development team lead,autodata solutions,manage onboarding new software developers interns assigned project team software development team lead responsible
521,enterprise protect trmis business systems analyst,td bank,data protection cloud security enterprise protect technology risk management information security trmis team directs supports td
522,analyst professional independence quality risk winter months months,deloitte,responsibilities include limited coordinating information requests data collection related monitoring activities interaction
523,wealth investment strategy,td bank,experience financial software data applications investment strategy team responsible ensuring investment integrity td
524,fall intern student business logistics management,tricorbraun,strong administrative data management skills great intern student intern student work
525,graduate student oil laboratory experimentalist,exxonmobil,graduate student oil laboratory experimentalist successful candidate join imperial oil heavy oil upstream research team
526,project management governance,td bank,work alongside teammates develop insights recommendations based enterprise portfolio research data analysis carve career
527,sap ixp intern gtlc compliance support,sap,provide codecenter support involves data entry tasks sap started team colleagues desire new
528,software development team lead,autodata solutions,autodata solutions transform complex data marketing sales solutions automotive industry core job duties responsibilities
529,enterprise protect trmis business systems analyst,td bank,data protection cloud security explain winning candidate think td crave meaningful work embrace change like
530,wealth investment strategy,td bank,experience financial software data applications explain winning candidate think td crave meaningful work embrace
531,coating engineer,qd solar,excel data analysis familiar data inventory tracking train staff interns processes
532,sap ixp intern agile test developer hana analytics,sap,agile test developer hana analytics intern working knowledge data structures algorithms principles oo design expected start date end date
533,senior computational engineer,augmenta,interactive graphics data visualization mentor junior staff interns reach best potential fluent python
534,embedded software developer,marecomms inc.,progress final report required interns previous experience using pcie cards acquire data appropriate buffering methods
535,ea sports devops engineer,electronic arts,mentor junior engineers new hires interns working knowledge database concepts database structures relational data bases related applications
536,chemical engineering student,suncor energy services,review daily production data accuracy bring data management systems extraordinary accuracy attention ability analyze
537,financial literacy internship,mount allison university,interviews data collection data management data oriented registrar s office mount allison university seeking
538,corporate legal intern,ntirety,knowledge data privacy laws corporate legal intern working directly general counsel operations
539,project coordinator,td bank,canadian banking data collections technology solutions t afford boring scale scope td does surprise
540,business analyst months,td bank,exceptional excel data management skills experience presenting data visually creatively canadian banking data collections technology solutions
541,engineering interns,hmr engineering,entering data participating various design projects grande prairie office currently searching geotechnical environmental
542,engineer reliability,cnooc international,site plot plans material selection diagrams piping instrumentation diagram p ids engineering data sheets hazops process hazards analysis phas
543,summer garage internship program software engineering program management vancouver,microsoft,communicate process understand progress delivery technical challenges provide clarity customer needs using
544,security engineer,td bank,data protection threat protection identity access management key management encryption sec dev security development analytics logging
545,mechanical engineering student,suncor energy services,build tool daily review production data develop handle tools tracking process data analysis metrics reporting
546,sap ixp intern technical project coordinator sap analytics cloud,sap,successful candidate analyzing project related data creating reports coordinating action items derived data
547,sap ixp intern agile developer pti partner management,sap,agile developer intern machine learning partner management working knowledge agile scrum test driven development performance testing
548,developer enterprise architecture,td bank,data architecture big data hadoop t afford boring scale scope td does surprise bring td
549,business systems analyst month,td bank,canadian banking data collections technology solutions t afford boring scale scope td does surprise
550,designer intern,throughline strategy inc.,throughline strategy hiring design intern keen information visualization communication design date resume
551,sap ixp intern software developer cloud platform services applications products,sap,software developer cloud platform services applications products intern working experience data structures algorithms principles oo design
552,talent acquisition coordinator internship,workland,maintain data integrity applicant tracking workland welcomes interns year workland internship program
553,business management analyst,td bank,confluence jira servicenow big data hadoop opportunity toronto ontario considered area canadian banking data
554,product development technician internship,margo supplies,searching product development intern including rapid prototyping sls printing satellite communication protocols embedded
555,lab technician,cargill,transportation work responsibility intern interns demonstrate exceptional performance curiosity learn
556,orchestration analyst,td bank,drive understand relationships data activities draw conclusions use critical thinking validate verify outputs
557,wealth business governance control,td bank,perform data analysis functions required intern support team following activities
558,senior software engineer,careguide inc,deep understanding various data stores recent intern say people management pure technical track
559,nations metis inuit candidates inclusion engagement hr internship,metrolinx,analyzing data contributing content design production distribution reports ensure interns indigenous persons
560,automation developer month,td bank,automation developer opportunity located toronto considered area canadian banking data collections
561,civil engineering student,suncor energy services,identify develop handle tools tracking process data analysis metrics reporting join use expertise
562,ea sports dev ops engineer contract,electronic arts,mentor junior engineers new hires interns working knowledge database concepts database structures relational data bases related applications
563,financial analyst management reporting winter months months,deloitte,medium level etl data mapping design reporting data mining experience reporting analysis financial transactional reports using various bi tools
564,senior software developer ios,sensibill inc.,mentor guide junior developers interns efficient receipt management critical health business day life
565,enterprise enabling technology solutions developer,td bank,practical experience knowledge following project management management reporting data modelling sql oracle ms sql
566,enterprise protect trmis cyber security analyst,td bank,ability perform analysis reporting information multiple data sources using data mining technique purpose documenting analysis results
567,materials test engineer,alchemy,experience successfully managing students interns and or research team resilience conviction necessary succeed rapidly
568,senior software engineer,careguide inc,deep understanding various data stores people management pure technical track functions data science product management
569,nations metis inuit candidates inclusion engagement hr internship,metrolinx,analyzing data contributing content design production distribution reports broader intern cohort indigenous
570,automation developer month,td bank,develop automation using java selenium testing applications integration testing sit environment hadoop big data environment
571,civil engineering student,suncor energy services,identify develop handle tools tracking process data analysis metrics reporting use expertise
572,senior software developer ios,sensibill inc.,mentor guide junior developers interns efficient receipt management critical health business developing mobile apps android
573,vice president ai engineering,vector institute,experience leading funding collaborating academic research projects graduate student interns university sponsored research
574,information security analyst threat management,td bank,ability perform analysis reporting information multiple data sources using data mining technique purpose documenting analysis results
575,security services product management,td bank,endpoint security access management data protection dlp threat protection asset explain winning candidate carve career
576,nations metis inuit candidates safety security internship,metrolinx,analyzing data contributing content design production distribution reports ensure interns indigenous persons
577,electrical engineering student,suncor energy services,review daily production data accuracy input data management systems summary reports performance metrics
578,rfp stack software development vendor peacegeeks arrival advisor project portfolio,peace geeks,collaborating development resources contractors interns brought project information management project new
579,enterprise protect trmis security business analyst,td bank,exceptional excel data management skills experience presenting data visually creatively explain winning candidate bring td
580,nations metis inuit candidates marketing internship,metrolinx,analyzing data contributing content design production distribution reports ensure interns indigenous persons
581,security services product management,td bank,endpoint security access management data protection dlp threat protection asset building team td t afford boring
582,enterprise protect trmis security business analyst,td bank,exceptional excel data management skills experience presenting data visually creatively t afford boring bring td
583,security services product management,td bank,endpoint security access management data protection dlp threat protection asset security services product management team responsible
584,nations metis inuit candidates safety security internship,metrolinx,analyzing data contributing content design production distribution reports broader intern cohort indigenous
585,enterprise protect trmis security business analyst,td bank,exceptional excel data management skills experience presenting data visually creatively market research delivery interpretation
586,nations metis inuit candidates marketing internship,metrolinx,analyzing data contributing content design production distribution reports broader intern cohort indigenous
587,security services product management,td bank,endpoint security access management data protection dlp threat protection winning career
588,nations metis inuit candidates safety security internship,metrolinx,analyzing data contributing content design production distribution ensure interns indigenous persons
589,rfp stack software development vendor peacegeeks arrival advisor project portfolio,peace geeks,collaborating development resources contractors interns brought information management project new
590,enterprise protect trmis security business analyst,td bank,exceptional excel data management presenting data visually winning bring td
591,nations metis inuit candidates marketing internship,metrolinx,analyzing data contributing content design production distribution ensure interns indigenous persons
592,vice president ai engineering,vector institute,vector institute seeking talented experienced vp ai engineering lead engineering staff scientist team working alongside machine
593,security services product management,td bank,tell story unnoticed explain winning candidate think td crave meaningful work embrace change like
594,electrical engineering student,suncor energy services,location calgary fort mcmurray alberta job number join student positions suncor including intern
595,information security analyst threat management,td bank,td description tell story unnoticed explain winning candidate think td crave meaningful work embrace
596,nations metis inuit candidates safety security internship,metrolinx,metrolinx agency government ontario oversees transit presto union pearson express mission champion deliver
597,rfp stack software development vendor peacegeeks arrival advisor project portfolio,peace geeks,organization based vancouver amman peacegeeks nonprofit organization builds digital tools empower communities pursuit peace
598,enterprise protect trmis security business analyst,td bank,td description tell story unnoticed explain winning candidate think td crave meaningful work embrace
599,nations metis inuit candidates marketing internship,metrolinx,metrolinx agency government ontario oversees transit presto union pearson express mission champion deliver
600,marketing intern,west island college,collect quantitative qualitative data marketing campaigns currently recruiting marketing intern currently
601,devops intern devops stagiaire,nuance,devops intern dynamic team collaborating r&d organization build release pipeline products services
602,intern devops tools winter,mackenzie investments,devops engineer devops tools department opportunity work larger project build showcase web app utilize spectrum devops
603,administrator unpaid intern,openconcept consulting inc.,stay latest trends web development hosting server configuration devops deployment orchestration continuous integration
604,devops developer internship months ottawa,ibm,devops developer interns demand ibm growth areas ibm work job calling think clients sell
605,devops developer coop months ottawa,ibm,devops developer interns demand ibm growth areas ibm work job calling think clients sell
606,devops engineer,td bank,opportunities various technology solutions areas job responsibilities devops students vary area t afford boring
607,programmer analyst intern,desjardins,intern java programmer analyst intern cobol programmer analyst intern quality assurance software analyst relevant work experience asset
608,ey client technology product engineer undergraduate master s intern,ey,seeking associate product engineers technology development hub established vancouver skills attributes success
609,consulting core business operations winter co op intern opportunities canada,deloitte,software development experience and scripting cloud platforms technology strategy agile practices methodologies devops automation
610,ea sports devops engineer,electronic arts,devops team looking talented devops engineer join team mentor junior engineers new hires interns
611,technical admin devops jss,lockheed martin corporation,participate structured cooperative educational work program company college university enrolled accredited degree
612,sap ixp intern concur locate software developer,sap,concur locate software developer intern java kotlin javascript typescript reactjs linux shell scripting sql databases web programming
613,backend developer,careguide inc,recent intern say experience devops scaling web applications hundreds millions users promise
614,ea sports dev ops engineer contract,electronic arts,devops team looking talented devops engineer join team mentor junior engineers new hires interns
615,sap ixp intern agile developer pti partner management,sap,agile developer intern machine learning partner management experience databases data deployment pipelines continuous integration
616,automation developer month,td bank,execute agile test automation leveraging devops ci cd framework jenkins bit bucket cucumber t afford boring bring td
617,senior software developer ios,sensibill inc.,mentor guide junior developers interns scrum kanban xp tdd design patterns inversion control ci cd test automation devops
618,senior software engineer,careguide inc,recent intern say experience devops scaling web applications hundreds millions users promise
619,intern devops tools winter,mackenzie investments,devops engineer devops tools work larger project build showcase web app utilize spectrum devops
620,devops developer internship months ottawa,ibm,devops developer interns demand ibm growth ibm work job calling think clients sell
621,devops developer coop months ottawa,ibm,devops developer interns demand ibm growth ibm work job calling think clients sell
622,devops engineer,td bank,opportunities various technology solutions areas job responsibilities devops students vary career
623,programmer analyst intern,desjardins,intern java programmer cobol programmer quality assurance software work experience asset
