,job_title,company_name,summary
316,machine learning programmer,ubc sauder,minimum midpoint maximum midpoint hiring salary range means individual possesses job knowledge
317,engineering quality assurance technician internship,fujifilm,analyze test results defect data identify problematic direction verification manager qa test team leader
318,marketing operations applied technologies intern program,bell canada,interns say line interacting directly analyzing vast customer looking
319,intern actuarial services tax month contract,ontario teachers' pension plan,intern department tasked providing support relied provide data advice projections statistics
320,intern project portfolio management month contract,ontario teachers' pension plan,resolution data exceptions anomalies.compile analyze key project portfolio data including project status cost resource effort
321,software analyst intern co op january start,thales group,analyse raw data field issues thales intern student great way launch career
322,intern taxation month contract,ontario teachers' pension plan,play important role ensuring integrity quality data used enterprise risk month contract months preferred
323,intern customer success offerings,autodesk,intern customer success offerings ll gather quantitative market data multiple market segments stay trends
324,telematics analytics intern engineer,sms equipment inc.,reporting manager smart construction telematics analytics intern responsible administration original equipment manufacturers
325,student intern supply chain management procurement,celestica,consolidates tabulates analyzes interns opportunity participate fun activities including intern social events celestica
326,operational technology summer interns,canadian national railway,additionally interns participating business case data collection analytics leading safer reliable network
327,finance winter,procter and gamble,critical thinking data analysis skills desire learn know term p g offers chance test
328,social media marketing intern,lauren ashley consulting,learn create insights analytics data develop strategic reporting knowledge social media love hear
329,engineering quality assurance technician internship months,fujifilm,analyze test results defect data identify problematic direction verification manager qa test team leader
330,developer london,td bank,canadian banking data collections technology solutions t afford boring scale scope td does surprise
331,community engagement intern,thunder bay regional health sciences foundation,community engagement intern role year nofhc internship community engagement intern work little supervision dependable
332,sales marketing intern,santorini dairies inc.,backup invoicing department including data entry experience marketing communications knowledgable social media website design
333,downstream chemical engineering intern,canadian natural,review process data sheet equipment mainly heat exchangers pumps vessels downstream engineering intern position opportunity
334,hr intern contract months,ups canada,ups currently looking hr intern general office duties including answering phone calls data entry filing richmond warehouse facility
335,technical department testing intern,biyork canada,record test results data microsoft office intern position gets foot door continue build team seeking
336,north american source quality jan months,johnson & johnson family of companies,interns supported ongoing coaching support mentorship job formal training support collection review organization
337,intern quantitative strategies research month contract,ontario teachers' pension plan,intern quantitative strategies research propose original ideas based personal interests prior experience graduate research test
338,brokerage operations intern,xpo logistics,able present clean organized thorough information data appropriate intended audience ll perform important duties including serving
339,health safety intern,"niagara falls, on",data entry training documentation tasks include data entry collection providing assistance preparation tracking reports filing
340,communications content intern danish speaking,careers at growth tribe,perfect communications content intern awesome ideas social content love brainstorming creating testing writing
341,stack developer september months ottawa,ibm,create mockups ui components algorithms data structures deliver complete minimally viable product
342,platform ad quality intern fall winter internship months,stackadapt,stackadapt hiring platform ad quality intern join growing programmatic partnerships team proficient microsoft excel including pivot tables
343,engineer mechanical,framatome,previous framatome intern experience ability comprehend convey detailed technical data join energy conversation framatome
344,mcafee cybersecurity internship,mcafee,cybersecurity intern expected solve challenging problems require passion conviction business works fronts
345,student intern sales,quad solutions,intern working projects include following look past interns filling positions
346,engineering intern field operating calgary office,canadian natural,engineering intern field operating calgary office engineering intern field operating calgary office safety sensitive position
347,logistics support intern january start,thales group,service delivery logistic support intern responsible enter relevant shipping receiving work flow data erp information sap
348,business development intern,adastra corporation,adastra transform data analytics space providing smart services solutions artificial intelligence big data cloud digital
349,open source compiler developer internship markham,ibm,open source runtime developer intern join hundreds developers actively contributing public github projects using
350,digital marketing intern,china telecom americas corporation,strong data analysis skills ability extract interpret data various sources utilize appropriate data develop
351,social media coordinator intern fall,spark growth,spark growth growing team passionate helping clients create meaningful human connections inspire action inclusive
352,user interface ui design intern stagiaire en conception interface usager,nuance,intern help designers create user experiences nuance welcomes interns year montreal
353,accounting internship,chs business solutions,processed payroll data created employee paycheque chs business solutions looking interns interested obtaining experience
354,stagiaire comptabilité intern accounting,sid lee,intern financial reporting systems implementation stagiaire repporting financier implantation système intern financial reporting
355,marketing coordinator intern,techo-bloc,integrate new data management software analyze survey data create reports want exciting opportunity learn love marketing
356,intern fpga database acceleration,reniac technology inc,experience knowledge data center reniac startup based silicon valley new office vancouver area
357,op intern rf electronic design intern,ciena,ciena important technology company ve heard innovations wow driverless cars granted
358,graduate transportation engineer analyst,arup,relevant intern and or research experience graduate transportation engineer analyst available looking opportunity shape
359,teachers innovation platform venture capital growth equity month contract,ontario teachers' pension plan,pull organize centralize data multiple sources experience working data preferred required limited travel required
360,customer service intern,spector & co,candidate comfortable phone data entry looking temporary customer service intern join customer service department
361,business development intern,adastra corporation,seeking highly motivated business development intern establish contact potential customers help understand service offerings
362,open source compiler developer internship markham,ibm,ibm work job calling think clients sell position resides markham work term
363,social media coordinator intern fall,spark growth,strategic checking boxes resourceful possibilities problems inclusive strong writing grammar skills
364,marketing coordinator intern,techo-bloc,integrate new data management software analyze survey data create reports marketing coordinator mandates fulfill
365,op intern rf electronic design intern,ciena,acting rf electronic design engineer involved design broadband components using technology platforms
366,graduate transportation engineer analyst,arup,relevant intern and or research experience graduate transportation engineer analyst available responsibilities specific role include
367,summer intern environmental engineering canada,nutrien,groundwater surface water data management assist department various duties including planning completing site s annual groundwater
368,intern metallurgical accounting software implementation commodities management,ion,ease mathematics statistical data analysis perform tuning statistical data reconciliation models contribute configuration
369,procurement supply management internship,canadian national railway,develop queries perform data analysis identify trends quantitative analysis queries data mining analysis qualitative analysis
370,human resources intern,chevron,assist maintaining accurate employee data records hris assist analysis current policies applicable market data
371,software engineering intern,schneider electric,analyse tests logs data improve test automation coverage working closely embedded hardware software verification validation
372,international internships,meda,support project staff compiling analysis financial data providing support project communication strategy
373,accounting internship months,canalyst,applying labels annotations financial data accounting intern mainly responsible sql c knowledge plus
374,internship northern spotted owl breeding program,british columbia conservation foundation,interns required provide food proper work clothes boots weather conditions research data analysis breeding
375,contract content marketing community intern capital markets social media,overbond,expertly interpret seo data readings effectively guide short long term plans content creation
376,blockchain,td bank,exceptional excel data management skills experience presenting data visually creatively ability investigate data
377,analyst intern january,loyaltyone,sql relational databases data warehouse bi data visualization tools leverage consumer data provideinsightful recommendations internal
378,actuarial student co op intern,intact,collect process verify analyze statistical data produce reports designed basis actuarial assessments passed cas soa exams preferred
379,quantitative analyst model validation group month contract,ontario teachers' pension plan,interns work closely team assesses complex models respect current planned use determines level model risk
380,summer internship program,"rothmans, benson & hedges inc.",numerical test assess ability manage analyze data inkompass unique paid summer internship program rothmans benson
381,machine learning programmer,university of british columbia,job producing machine learning software support research data driven discovery models https www…
382,growth consultant intern danish speaking,careers at growth tribe,reaching answering requests warm leads updating data using crm hubspot growth consulting growth tribe academy denmark aims
383,analyst intern january,precima,sql relational databases data warehouse bi data visualization tools leverage consumer data provideinsightful recommendations internal
384,summer intern,gitxsan development corporation,intern work gdc hazelton office providing administrative support generating reports handling data input developing relationships
385,planner winter,stantec,maintain project data correspondence organized manner driving future community development yes time
386,indigenous human resources intern,express scripts,intern assist processing internal external job postings resume responses express scripts open positions
387,asic development engineer undergrad intern,intel,memory devices solid state drives ssds support level data center caching storage tier enthusiast usage
388,social media intern,fast track marketing,individual responsible activities related web platform maintenance upgrades social meeting channel management digital promotional tools
389,investment risk co op internship winter,bc imc,gather organize evaluate data new investments existing portfolio assets private market asset teams
390,software development engineer co op intern january,a thinking ape,worked upgrading data pipeline processing data creating different data representations visualizations help ata make marketing
391,marketing intern,west island college,collect quantitative qualitative data marketing campaigns time month internship outstanding athletics small class sizes extensive
392,actuarial student internship winter,intact,participate team daily work analyzing actuarial data propose changes provide assistance product pricing corporate planning
393,sap ixp intern associate product manager,sap,background business intelligence financial planning and or data science plus meet mentors make new friends globe create
394,junior project manager environmental services contract intern,chinook environmental services ltd.,review interpretation laboratory data permanent position years age younger
395,geotechnical design intern,canadian natural,assist engineers producing technical deliverables analysis construction instrumentation data perform reporting drafting needed
396,intern application support analyst month contract,ontario teachers' pension plan,producing reports communicate data analysis findings observations conducting data analysis business processes identify trends opportunities
397,analyst sustainable finance winter,rbc,analyze environmental social governance esg data use driving client marketing materials essential qualities look include
398,intern analyst internal audit january april,psp investments,support team preparing information data analysis seeking intern analyst internal audit partner key stakeholders peers
399,time sales intern,upfeat media inc.,ability interpret sales online traffic data convert presentations working exciting fast paced environment liaise
400,civil engineering intern,canadian natural,analyze construction instrumentation data process interpret geotechnical instrumentation field lab data
401,distribution geospatial intelligence analyst,td bank,support strategic business development analyzing presenting customer data census data canadian wealth data different segmentation systems
402,customer service support intern mobile,china telecom americas corporation,use excel sheet conduct general data editing analyzing bachelor s degree preferred concentration mobile telecom data analysis
403,industrial engineering intern,evraz north america,help promote decision driven data facts instead opinions industrial engineering intern assist various capex investment
404,devops engineer,td bank,champion test driven development practices engineering line business developers continuously improve jenkins build test
405,atl finance intern program advanced analytics,bell canada,comfortable big data analytics deep dive analysis working knowledge statistics statistical data analysis techniques application
406,equity research internship months,canalyst,strong pc skills specifically microsoft office applications sourcing data internet internship program meant stepping
407,intern risk analytics output month contract,ontario teachers' pension plan,risk analytics team supports monitoring reporting fund s overall market credit liquidity risk exposure support
408,january tax accelerate co op winter intern cpa oakville,pwc,aptitude excel complex calculations data analysis accounting commerce related degrees appropriate cpa conversion programs
409,google adwords intern,fast track marketing,working website management team product services collateral design managing social media channels distribution web
410,developer gta months,td bank,knowledge data generation data masking data sub setting data archiving data masking data virtualization perform unit integration testing
411,risk modelling co op internship winter,bc imc,excellent career development training helping candidate understand tools data methodologies applied financial institutions
412,media advertising internship,ipg mediabrands,keen media advertising marketing data related pursuing degree diploma certificate accredited institution
413,asset integrity engineering intern,canadian natural,perform analysis piping inspection data provide engineering recommendations ongoing repair mitigation strategies
414,software developer internship markham,ibm,mission deliver runtimes ibm contributed significant diagnostic tooling like failure data capture
415,engineering student winter,aecon group,provide management data project analysis provide data input reconciliation aecon s civil west major projects group
416,sap ixp intern associate predictive product manager,sap,requires candidates currently enrolled undergraduate masters mba phd degree program fields business business information
417,accountant intern,rdm disposal inc.,rdm disposal boutique family owned operated waste disposal service seeking accounting intern integral team
418,civil engineering intern,canadian natural,civil engineering intern opportunity civil geological engineering student geotechnical group focus
419,distribution geospatial intelligence analyst,td bank,tell story unnoticed explain winning candidate think td crave meaningful work embrace change like
420,customer service support intern mobile,china telecom americas corporation,china telecom americas seeking responsible business support intern join mobile business
421,industrial engineering intern,evraz north america,evraz north america manufacture engineered steel products rail energy industrial end markets production sites located usa
422,devops engineer,td bank,tell story unnoticed explain winning candidate think td crave meaningful work embrace change like
423,atl finance intern program advanced analytics,bell canada,req id bell build networks develop innovative services create original multiplatform media content
424,equity research internship months,canalyst,join canalyst equity research team equity research intern term opportunity contribute database fundamental
425,intern risk analytics output month contract,ontario teachers' pension plan,opportunity january 2020 may august excited future big data finance yes team
426,january tax accelerate co op winter intern cpa oakville,pwc,line service tax industry sector applicable specialism industry tax practice management level associate job description summary pwc canada
427,google adwords intern,fast track marketing,marketing manager fast track marketing working website management team product services collateral design managing social
428,developer gta months,td bank,td description tell story unnoticed explain winning candidate think td crave meaningful work embrace
429,risk modelling co op internship winter,bc imc,use research investment skills company impact british columbia investment management corporation bci
430,media advertising internship,ipg mediabrands,media planning buying imagine clients like rbc johnson johnson westjet walmart spend
431,asset integrity engineering intern,canadian natural,asset integrity engineering intern opportunity team asset integrity engineers implements wide variety inspection repair
432,software developer internship markham,ibm,introduction ibm work job calling build design code consult think clients sell make markets
433,engineering student winter,aecon group,aecon s civil west major projects group opening division student intern placement toronto months position
434,sap ixp intern associate predictive product manager,sap,requisition id work area solution product management expected travel career status student employment type intern company description
435,summer intern data science engineering,hsbc bank canada,overview mission drive informed solve complex problems using latest technologies rapidly implement insights
436,student intern,skyworks,looking challenging exciting career world technology look skyworks innovator high performance analog
437,marketing communication event intern months paid contract,pathways serious mental illness society,excellent written oral communication skills including ability produce reports maintain records provide data evaluation
438,intern analyst real estate investments august,psp investments,intern analyst real estate investments ll provide assistance analysts researching synthesizing analyzing data various real
439,software developer,warranty master,looking brilliant student thinkers join masterminds currently considering positions internships available
440,analyst financial engineering analytics winter co op intern,deloitte,exercising strong communication skills written verbal including experience conducting research synthesizing data writing reports
441,business analysis trade efficiencies month contract,ontario teachers' pension plan,business analyst focused implementation support improvements order management execution systems enable
442,intern derivatives operations month contract,ontario teachers' pension plan,reconciling large data sets ensure data quality req intern derivatives operations months months preferred summer winter
443,account executive,schaeffler group,maintain forecast data support quote engineering proposals electrical mechanical mechatronics materials engineering students
444,multimedia specialist,td bank,canadian banking data collections technology solutions building team td t afford boring
445,design research,td bank,assisting data synthesis report writing td design research intern given opportunity support phases
446,content management experience developer,td bank,work internal content design technical teams deliver digital experiences web mobile devices cover letter maximum page
447,eets finance developer,td bank,practical experience knowledge following management reporting data modelling sql oracle ms sql database development
448,intern business analyst month contract,ontario teachers' pension plan,help identify data sources deliver data specifications including data profiling work data vendor manager source clarify new existing
449,january risk assurance services accelerate co op winter intern cpa toronto york,pwc,help clients manage data better feel confident information generated business data reliable help make
450,intern analyst internal audit january april,psp investments,support team preparing information data analysis seeking intern analyst internal audit partner key stakeholders peers
451,senior intern analyst finance analytics risk,cpp investment board,assurance advisory provides assurance operating controls governance risk processes safeguard cppib assets returns undue risk
452,intern investment analyst strategy risk month contract,ontario teachers' pension plan,depending candidate s skill level sql role primarily sql development data management primarily data management
453,internship pension administration winter semester,morneau shepell,performs data reconciliations benefit calculations responsible data analysis validations handling using morneau shepell internal
454,pharmacy intern,medilink remedysrx pharmacy,supervision pharmacist pharmacy intern perform data entry filling packaging compounding plus provide support
455,office admin time intern,upi canada,data analyst skill plus data entry ability maintain electronic hard copy filing assist resolving administrative problems
456,investment valuations co op internship winter summer,bc imc,assist development maintenance valuation database data visualization tool ability gather process large data sets
457,intern total fund reporting month contract,ontario teachers' pension plan,experience spread sheet engineering ability consolidate prepare verify data metrics reports
458,analyst intern january,alliancedata,sql relational databases data warehouse bi data visualization tools leverage consumer data provide insightful recommendations internal
459,business development marketing intern,rathnelly group media,capable keeping accurate record lead data company crm customer relationship management needed attend sales meetings presentations
460,bci women capital markets public markets co op internship winter summer,bc imc,assisting esg integration team data collection research modeling proxy voting excellent career development training helping
461,digital marketing intern,techo-bloc,evaluate market conditions benchmark competitor data audit strategize plan coordinate execute track optimize s
462,marketing intern,rise cpa,updating data base firm s contact alliances reporting marketing coordinator core responsibility role includes
463,financial analyst financial analysis business support winter,deloitte,advanced excel macros functions working large volumes data fabs team role business performance group
464,stack engineer,wise systems,wise systems came mit inspired goal using data make cities smarter autonomous dispatch routing
465,intern analyst investment finance april,psp investments,seeking intern analyst investment finance partner key stakeholders peers support engage powerful networks people
466,sap ixp intern general business dde global coordinator,sap,includes preparation reports data analysis benchmark teams data query understanding use excel powerpoint tools
467,intern analyst real estate investments january april,psp investments,provide assistance analysts researching synthesizing analyzing data various real estate markets eagerness learn ideate innovate
