,job_title,company_name,summary
0,summer intern data science engineering,hsbc bank canada,building changing predictive analytical solutions big data pipelines data science machine learning curious
1,student intern,skyworks,strong data analysis skill support pes customer rma testing data crunching intern electrical engineer network telecom entry level
2,data scientist intern,geotab,data scientist intern work alongside team fellow data scientists geotab s data analytics team ready challenge
3,data engineer omnia ai co op intern winter multiple locations,deloitte,fascinated data structures data models data patterns interested wrangling joining melting data sets create foundation
4,data science intern winter toronto,intact,currently looking interns data lab r&d department transform complex data sets meaningful conclusions recommendation
5,data insight specialist co op intern,general motors,data insight specialist assist warranty field action technical services departments identifying key trends data insights
6,data analyst intern,upfeat media inc.,looking data analyst intern join rapidly expanding team using provided tools perform research analyse data sets
7,intern data science,rs energy group,analyze interpret heterogeneous data troubleshoot errors data science models data science team
8,instructional writer data science intern,geotab,geotab seeking intern immediately contribute organization data analytics team efforts ready challenge
9,op intern photonics networking,ciena,autonomous photonic networks team responsible defining novel disruptive photonics architectures control systems
10,applied research lab intern,ch four biogas inc.,perform sample analysis collect data currently looking intern role r&d team ch biogas projects related
11,business support intern data analytics,geotab,geotab actively seeking business support intern data analytics department support business objectives related solutions deployed
12,analyst strategic operational risk winter intern co op multiple locations,deloitte,advisory service line helps organizations transform ways leverage people relationships technology data business processes
13,associate consultant intern data services university program summer,mastercard,associate consultant intern data services university program summer ac intern make impact associate consultant intern
14,student intern customer data analyst,celestica,product data management global business services communicate external customers resolve missing and or inaccurate data
15,research intern toronto waterloo,google,creating experiments prototyping implementations designing new architectures research interns software engineers work challenges
16,data scientist internship opportunities,nestlé canada inc.,data scientist intern explore data answering questions finding new business opportunities data enthusiast sep pm
17,op intern data analytics,ciena,data modeling data structures algorithms plus experience data sciences machine learning plus good knowledge telecommunication network
18,analytics data science co op intern,td bank,office chief data officer experience data management analytics project management plus explain winning candidate
19,brand management summer intern,procter and gamble,additionally use historical data intern big day brand intern multiple make great fit
20,accountant intern,rdm disposal inc.,compile data compute charges prepare invoices file orders invoices rdm disposal boutique family owned operated waste
21,summer intern data science engineering,hsbc bank canada,building changing predictive analytical solutions big data pipelines data science machine learning
22,student intern,skyworks,strong data analysis skill support pes customer rma testing data crunching addition chance support customer rma
23,intern opportunities students user experience,microsoft,knowledge methods gathering analyzing ux research data experience reviewing user research data build strategic design
24,web front end developer intern,geotab,successful role individual passionate development exceptional organizational
25,associate managing consultant intern data services university program summer,mastercard,experience using data analysis querying tools exceptional analytical interpretive skills including proven ability
26,python developer intern,geotab,work closely data engineering team develop data pipelines collaborate data engineering science team help build libraries
27,genuine analyst intern,autodesk,analyze piracy trends usage data summarize data findings power point research analysis industry qualitative data media entertainment
28,developer intern,geotab,receive detailed data metrics millions vehicles processed interpreted create actionable information customers
29,software developer intern bs summer,google,experience data structures algorithms completing data structures algorithms class coursework course projects research individual
30,data science coop calgary ab,ibm,team looking candidates exceptional technical aptitude passion applied data science telling stories data
31,programming intern,airsuite,programming intern work closely developers technical managers conceptualize implement features refactor code research
32,op intern blue planet analytics,ciena,building adaptive network driven artificial intelligence using latest end technologies
33,winter security ip intern 4 8 months,synopsys,integrated solutions enable efficient silicon design highest level security help prevent wide range evolving threats
34,intern applied research,alberta innovates,acquire expertise emerging technology areas particular data analytics machine learning simulation recovery processes physical
35,op intern harware engineer,ciena,spec reviews research qualify alternate sources data analysis review manufacturing data assess design test changes improve factory
36,op intern photonic development,ciena,working packaging team data transfer screening reporting senior design manager photonics ic r&d working design
37,data scientist,visier inc.,doing bring table expect work let s fun perks know thing
38,research assistant intern,northern ontario school of medicine,participate gathering research data compilation analysis reporting presentation building research assistant intern
39,reporting analytics intern months starting jan,wells fargo,enjoy taking complex data breaking quantifiable metrics dashboards work manager identify data sources design new reports
40,underwriter intern months starting jan,wells fargo,data governance financial analysis know customer mitigating potential risks wells fargo commercial distribution finance cdf provides
41,software developer intern implementation winter,coveo,development data extraction modules c python course invited participate company activities happy hours lunch
42,data validation intern,intuitive ai,working team maintain update process large repositories image data working closely machine learning engineers process extract
43,engineering intern,jacobs,collecting prepares data evaluation performing routine aspects engineering requiring knowledge application basic engineering principles
44,finance summer intern,procter and gamble,critical thinking data analysis skills desire learn leaders strategy development execution business financial
45,software developer intern,geotab,using google bigquery develop tools analysis ipython scripts make sense production data use git source control
46,software developer intern ms summer,google,experience data structures algorithms completing data structures algorithms class coursework course projects research individual
47,data scientist global dttl,deloitte,data cleansing data mining techniques tools perform application development and or business analysis broader project team focused
48,finance controlling intern,mercedes-benz canada,expected support rv manager data analytics presentations days assisting manager ad hoc inquiries
49,clinical operations associate intern jan months,johnson & johnson family of companies,able critically appraise clinical trial health data analyze interpret complex data multiple sources advanced knowledge excel required
50,software engineer intern winter summer fall,tableau,software engineer interns work joint projects tableau software engineers summer similar time period area related tableau
51,intern analyst integration data services january april,psp investments,seeking intern analyst integration data services partner key stakeholders peers support engage powerful networks
52,software developer intern waterloo winter,google,experience data structures algorithms gathered completing data structures algorithms class coursework projects research internships
53,software engineer stack internship,tripadvisor,depth understanding data structures algorithms develop features quickly used millions work thrive fast paced environment
54,engineer test intern,corelogic,analysis results documenting communicating test results qa lead assist creating designing executing manual test cases test scripts
55,software developer intern r&d winter,coveo,work core coveo index data stored using course invited participate company activities
56,advanced analytics intern,td bank,performing multiple data extractions processing data prepare modeling implementing and or reporting good knowledge word excel powerpoint
57,summer software developer intern,workiva inc.,solid foundation computer science competencies data structures algorithms software design
58,finance intern,philips,prepare maintain pricing master data jda forecast plan tool she he demonstrate superior analytical skills enjoy making sense data
59,student intern corporate sustainability,celestica,support celestica s sustainability data analytics software fun intern activities including celebration events networking
60,op intern pic design,ciena,working packaging team data transfer screening reporting senior design manager photonics ic r&d working design
61,finance compliance intern,smartsimple software inc.,conduct research various data protection privacy laws present findings internal stakeholders finance compliance intern report
62,software developer intern phd summer,google,experience computer science strong competencies data structures algorithms software design contribute wide variety projects
63,intern technology risk ciso winter,mackenzie investments,intern technology risk ciso department identify analyze data evaluate effectiveness security controls
64,hydrogeology intern,canadian natural,final intern project presentation hydrogeology intern reports directly onsite hydrogeologist supports oil sands
65,software developer intern,alloy,hire interns review applications rolling basis enjoy building data pipelines process billions data points day
66,office intern,tefron,assistance importing data building standard templates seeking office intern assist support team
67,plant pathology ontario,syngenta,plant pathology plattsville preparation research materials laboratory maintenance maintaining fungal cultures fungal identification
68,content display quality intern,rakuten kobo inc.,kobo intern work closely passionate data driven content qa team review incoming content customer feedback
69,hr adminstrative services intern,mercedes-benz financial services canada,responsible completing administrative duties required photocopying data entry filing updating employee recruitment files
70,quantitative risk intern model development model governance,td bank,data mining making sense large databases historical data related credit risk strong working knowledge experience using sas sql
71,intern content development,the aldo group inc.,competitive or research data gathering aldo content development team seeking intern assist
72,internship opportunities students sales,microsoft,modern workplace business applications apps infrastructure data ai applications opportunities considered available sales
73,audit intern co op winter,td bank,fromexamining evaluating information technology infrastructure policies operations protecting corporate data assets help maintain
74,software solutions prototyper dspace winter co op intern,deloitte,python java oop programming language css javascript web related frameworks angular reactjs jquery bootstrap foundation
75,intern analyst data management january april,psp investments,intern analyst data management ll maintain referential data central data repository integrate required data team s tools
76,brand communications intern months,bmw group canada,creation campaign reports aggregating variety data sources organizing results help inform campaign planning activities
77,social media intern,bather,intern opportunity learn use insights data inform content creation decisions report social
78,junior network analyst intern,debian information technology,junior network analyst work support admin tasks perform updates cleanup tasks data information debian s
79,business intelligence analytics intern,bgis,perform exploratory data analysis eda data identify opportunity areas utilizing tools handle large data volumes
80,program administrator intern,geotab,transfer data customer relation management programs team presentations weekly geotab actively seeking intern contribute
81,intern,csa group,collecting analysing data scorecards process maps order considered intern role building world class team starts
82,intern technology risk ciso winter,mackenzie investments,identify analyze data evaluate effectiveness security controls activities carried principally investors group
83,hydrogeology intern,canadian natural,hydrogeology intern reports directly onsite hydrogeologist supports oil sands mining operations cnrl albian sands including
84,software developer intern,alloy,automate collection parsing storage huge volumes data engineers alloy tasked solving interesting difficult problems
85,office intern,tefron,assistance importing data building standard templates year contract temporary position possibility
86,plant pathology ontario,syngenta,preparation research materials laboratory maintenance maintaining fungal cultures fungal identification dna extraction data collection analysis
87,internship opportunities students sales,microsoft,account executive main connection point microsoft provide strategic business leadership partnering
88,intern analyst data management january april,psp investments,maintain referential data central data repository integrate required data team s tools designed help ensure data governance
89,program administrator intern,geotab,transfer data customer relation management programs team presentations weekly program administrator intern key area responsibility
90,accountant intern,rdm disposal inc.,compile data compute charges prepare invoices file orders invoices track record charges customers ability prioritize multitask
91,intern,csa group,collecting analysing data scorecards process maps accommodate work terms months length
92,intern capital markets,ivanhoe cambridge,ability analyze structure complex data familiarity information systems data mining implemented crm improve relationships
93,op intern optical systems,ciena,position involve working senior developers extract organize visualize product performance data programming python matlab
94,evaluation data management intern,paro centre for women's enterprise,plays critical role assisting research data collection maintenance data analysis evaluation new projects
95,intern instagram facebook ads,burlington training centre,company burlington training centre located just appleby line fairview corner station btc
96,analytics intern fall,j. walter thompson,actively seeking curious collaborative analytics intern assist team analyzing data identify actionable insights
97,production development technician red deer alberta,syngenta,preparation research materials plot layout application compounds record keeping data collection analysis results
98,intern sales marketing,dream unlimited,gathering competitive data competitive analysis want continue honing skills working office environment ll able
99,ux ui developer intern,geotab,writing javascript code react angular css scss make sure ui ux looks feels awesome people search engines
100,tds global operations business services intern,td bank,consists daily validation analysis mvp data asset control data reconciliation downstream systems
101,student intern corporate supply chain associate,celestica,fun intern activities including celebration events networking data entry using computer mouse using calculator
102,analyst cyber risk services winter intern co op multiple locations,deloitte,integrate threat data data business data equip security teams intelligence proactively detect manage cyber threats
103,intern enterprise risk management,ivanhoe cambridge,analyze data collected propose ways protect mitigate respond identified risk reporting senior director enterprise risk
104,data engineer,freshbooks,passion backend development data engineering participate technical decisions affect freshbooks data architecture make lasting impact
105,analyst m advisory rotational program winter co op intern,deloitte,exercises strong communication skills written verbal including experience conducting research synthesizing data writing reports
106,deep learning intern content technology winter spring,nvidia,apply deep learning techniques simulation virtual environments developing methods generate synthetic data training neural networks
107,ux research intern,loopio,understanding worked methods data synthesizing summarizing findings using multiple data sources inform product ux
108,student intern database development,parsons,compiles data performs dimensional routine calculations required preparation drawings need interns versatile enthusiastic
109,finance intern,serco inc.,addition aid various day day tasks initiatives filing data entry recoding spreadsheet management customer refund
110,human resources intern,health sciences north.,compile analyze data required demonstrated ability analyze convert data useful information
111,intern investments industrial north america,ivanhoe cambridge,help compile process update data incorporate existing database works general supervision
112,op intern waveserver software,ciena,waveserver product development team s mission develop data center interconnect optical transport products solutions web
113,op intern waverserver software,ciena,waveserver product development team s mission develop data center interconnect optical transport products solutions web
114,software developer intern,upfeat media inc.,looking data tools content publishing help better inform empower writers reach bigger audience
115,ey client technology product engineer undergraduate master s intern,ey,data modelling database technologies data visualization analysis engineer algorithms data structures problem solve build scale
116,hr systems intern month position summer,canadian national railway,contribute improving data quality ensure data integrity hr systems human resources systems intern directly assist hr technology team
117,human resources intern,health sciences north (hsn),compile analyze data required demonstrated ability analyze convert data useful information
118,intern legal,international olympic committee,provide legal advice data protection intellectual property labour law legal intern requested address duties assigned
119,student intern buying,celestica,interns opportunity participate fun activities including intern social events celestica s charitable initiatives spirit
120,marketing intern fall immediate start,shoplogix,offer innovative solution transforms way analyze interpret data drive machine process efficiency
121,intern data management operations month contract,ontario teachers' pension plan,participates data exception process resolve data exceptions using applications bloomberg reuters datascope oracle edq pl sql markit edm
122,sap ixp intern intelligent data analytics business intelligence analytics developer,sap,intelligent data analytics business intelligence analytics developer intern knowledgeable sql scripting data modeling database design
123,supply network operations intern,procter and gamble,supply network operations sno intern analyzing data thinking critically uncover insights help
124,sourcing analytics intern month position summer,canadian national railway,strong analyzing data order draw driven conclusions ability translate data reports presentations
125,software engineer intern summer months,kepler communications,invest heavily deliver best products customers hunt software engineer intern
126,intern landscape planning,province of nova scotia,intern landscape planning internship truro provide quality control assurance digital data occasionally prepare cartographic
127,student intern hris,celestica,works sites ensure data integrity provides support data reporting needs hris s runs delivers reports needed
128,intern analyst,synced technology inc.,synced leading information service provider field artificial intelligence branching consulting investment data platform services
129,product development technician plattsville ontario,syngenta,product development technician plattsville ontario product development technician plattsville ontario hr gnrl mgt
130,student intern supplier quality engineering,celestica,interns opportunity participate fun activities including intern social events celestica s charitable initiatives spirit
131,civil technician intern,aecom,experience collecting preliminary survey data using gps total station technology and or aecom actively seeking highly motivated engineering
132,office intern,helix global solutions,office intern responsible assisting staff general office duties including limited research data entry filing
133,supply chain intern months,johnson & johnson family of companies,advanced knowledge ms excel using large data sets formulas reporting knowledge interns supported ongoing coaching support guidance
134,intern recent graduate,gfd,north american leader fundraising provide suite services nonprofit partners including donor acquisition
135,research intern artificial intelligence,facebook,ability manipulate analyze complex large scale data varying sources facebook seeking research interns join facebook
136,intern ecommerce java software developer,sap,intern primarily responsible ecommerce application software development based client requirements good verbal written english
137,summer intern business development,salesforce,summer intern business development training bda intern integral sales team
138,analyst forensics aml financial advisory winter co op intern toronto,deloitte,intern forensics aml team analyze financial data relevant information related allegations financial crime
139,intern geologist,rio tinto,work high standards quality assurance quality control data validation geological data working hard
140,ad operations intern,wattpad,strong analytical quantitative skills ability interpret data analysis modelling results actionable recommendations
141,supply chain analyst intern job,metro inc.,industrial engineering intern responsible data analysis time studies process mapping kpi reporting presentation solutions
142,market risk winter co op intern,td bank,understanding security data csa data client data market data addition trade valuation data advanced ms excel ms access data analysis
143,marketing internship,coty canada,looking motivated marketing intern join canadian rimmel team coty global leader beauty primarily responsible
144,op intern linux base team,ciena,contribute new hardware products providing device drivers configuring asics fpgas phys establish functional data path
145,drilling completions intern,chevron,strong computer applications knowledge excel word powerpoint outlook data analytics tools spotfire accumap look
146,marketing intern,philips,synthesize analyze market data intern marketing markham summer interested intern opportunity philips
147,localization intern,geotab,geotab seeking intern immediately contribute organization localization team efforts ready challenge
148,analyst applied innovations risk advisory winter co op intern toronto,deloitte,help clients technology needs fusing artificial intelligence ai machine learning ml data science ds effort
149,civil technician intern,aecom,experience collecting preliminary survey data using gps total station technology and or provide technologist technician services projects
150,supply chain intern months,johnson & johnson family of companies,advanced knowledge ms excel using large data sets formulas reporting knowledge supply chain intern markham location
151,intern recent graduate,gfd,looking ability thrive fast paced changing climate strong listening presentation skills
152,research intern artificial intelligence,facebook,ability manipulate analyze complex large scale data varying sources perform research enables learning semantics
153,summer intern business development,salesforce,researching prospective clients adding valuable data new existing accounts acquiring contacts leveraging
154,analyst forensics aml financial advisory winter co op intern toronto,deloitte,analyze financial data relevant information related allegations financial crime learn deep subject matter experts mentoring
155,intern geologist,rio tinto,work high standards quality assurance quality control data validation geological data internship geology
156,marketing internship,coty canada,new graduate professional looking experience beauty industry role offers meaningful hands work experience
157,drilling completions intern,chevron,strong computer applications knowledge excel word powerpoint outlook data analytics tools spotfire accumap legally entitled work canada
158,marketing intern,philips,synthesize analyze market data provide insights recommendations addressing key findings data interns gain firsthand exposure
